{
  "source": "SRD_CC_v5.1",
  "ruleset_version": "5.1",
  "builder_version": "0.23.0",
  "schemas": {
    "ability_score": "1.0.0",
    "class": "2.1.0",
    "condition": "2.0.0",
    "damage_type": "1.0.0",
    "disease": "2.0.0",
    "equipment": "2.1.0",
    "features": "3.0.0",
    "lineage": "2.0.0",
    "magic_item": "2.0.0",
    "monster": "2.0.0",
    "poison": "2.0.0",
    "rule": "2.0.0",
    "skill": "1.0.0",
    "spell": "2.0.0",
    "table": "2.0.0",
    "weapon_property": "1.0.0"
  },
  "license": {
    "type": "CC-BY-4.0",
    "url": "https://creativecommons.org/licenses/by/4.0/legalcode",
    "attribution": "This work includes material taken from the System Reference Document 5.1 (\"SRD 5.1\") by Wizards of the Coast LLC and available at https://dnd.wizards.com/resources/systems-reference-document. The SRD 5.1 is licensed under the Creative Commons Attribution 4.0 International License available at https://creativecommons.org/licenses/by/4.0/legalcode.",
    "conversion_note": "Converted from the original PDF by srd-builder (https://github.com/wolftales/srd-builder) version 0.23.0"
  },
  "build": {
    "pdf_hash": "sha256:2504d2a0abb0a4d491a939be4f17910a2dde0312570ab8d208080225ccf0a1f0"
  },
  "page_index": {
    "legal": {
      "start": 1,
      "end": 1,
      "description": "Legal information, license (CC-BY-4.0), attribution"
    },
    "lineages": {
      "start": 3,
      "end": 7,
      "description": "Character lineages (races): Dwarf, Elf, Halfling, Human, etc.",
      "dataset": "lineages"
    },
    "classes": {
      "start": 8,
      "end": 55,
      "description": "Character classes: Barbarian through Wizard (12 classes)",
      "dataset": "classes"
    },
    "beyond_1st_level": {
      "start": 56,
      "end": 61,
      "description": "Advancement: XP, leveling, multiclassing"
    },
    "equipment": {
      "start": 62,
      "end": 74,
      "description": "Equipment tables: armor, weapons, gear, services, costs",
      "dataset": "equipment"
    },
    "feats": {
      "start": 75,
      "end": 75,
      "description": "Optional feat: Grappler"
    },
    "using_ability_scores": {
      "start": 76,
      "end": 83,
      "description": "Ability checks, saving throws, skills, modifiers"
    },
    "time": {
      "start": 84,
      "end": 84,
      "description": "Time in D&D: rounds, minutes, hours, days"
    },
    "movement": {
      "start": 84,
      "end": 85,
      "description": "Movement rules: speed, difficult terrain, climbing, swimming"
    },
    "environment": {
      "start": 86,
      "end": 87,
      "description": "Environmental hazards: falling, suffocating, vision"
    },
    "between_adventures": {
      "start": 88,
      "end": 89,
      "description": "Downtime activities: resting, lifestyle expenses"
    },
    "combat": {
      "start": 90,
      "end": 99,
      "description": "Combat rules: initiative, actions, attacks, damage, conditions"
    },
    "spellcasting": {
      "start": 100,
      "end": 104,
      "description": "Spellcasting rules: components, concentration, spell slots"
    },
    "spell_lists": {
      "start": 105,
      "end": 113,
      "description": "Spell lists by class (Bard, Cleric, Druid, etc.)"
    },
    "spell_descriptions": {
      "start": 114,
      "end": 194,
      "description": "Spell descriptions: 319 spells from Acid Splash to Wish",
      "dataset": "spells"
    },
    "traps": {
      "start": 195,
      "end": 198,
      "description": "Traps: sample traps, detection, effects"
    },
    "diseases": {
      "start": 199,
      "end": 200,
      "description": "Diseases: Cackle Fever, Sewer Plague, Sight Rot"
    },
    "madness": {
      "start": 201,
      "end": 202,
      "description": "Madness: short-term, long-term, indefinite"
    },
    "objects": {
      "start": 203,
      "end": 203,
      "description": "Objects: AC, hit points, breaking objects"
    },
    "poisons": {
      "start": 204,
      "end": 205,
      "description": "Poisons: types, application, effects, costs"
    },
    "magic_items": {
      "start": 206,
      "end": 253,
      "description": "Magic items: rarity, tables, A-Z descriptions, sentient items, artifacts",
      "dataset": "magic_items"
    },
    "monsters": {
      "start": 254,
      "end": 357,
      "description": "Monster stat blocks: creatures before appendices",
      "dataset": "monsters"
    },
    "appendix_ph_a_conditions": {
      "start": 358,
      "end": 359,
      "description": "Appendix PH-A: Conditions (Blinded, Charmed, Deafened, etc.)",
      "dataset": "conditions"
    },
    "appendix_ph_b_pantheons": {
      "start": 360,
      "end": 362,
      "description": "Appendix PH-B: Fantasy-Historical Pantheons"
    },
    "appendix_ph_c_planes": {
      "start": 363,
      "end": 365,
      "description": "Appendix PH-C: The Planes of Existence"
    },
    "appendix_mm_a_creatures": {
      "start": 366,
      "end": 394,
      "description": "Appendix MM-A: Miscellaneous Creatures",
      "dataset": "monsters"
    },
    "appendix_mm_b_npcs": {
      "start": 395,
      "end": 403,
      "description": "Appendix MM-B: Nonplayer Characters (NPCs)"
    }
  },
  "datasets": {
    "ability_scores": {
      "file": "ability_scores.json",
      "count": 6,
      "status": "complete"
    },
    "classes": {
      "file": "classes.json",
      "count": 12,
      "status": "complete"
    },
    "conditions": {
      "file": "conditions.json",
      "count": 15,
      "status": "complete"
    },
    "damage_types": {
      "file": "damage_types.json",
      "count": 13,
      "status": "complete"
    },
    "diseases": {
      "file": "diseases.json",
      "count": 3,
      "status": "complete"
    },
    "equipment": {
      "file": "equipment.json",
      "count": 259,
      "status": "complete"
    },
    "features": {
      "file": "features.json",
      "count": 245,
      "status": "complete"
    },
    "lineages": {
      "file": "lineages.json",
      "count": 13,
      "status": "complete"
    },
    "magic_items": {
      "file": "magic_items.json",
      "count": 240,
      "status": "complete"
    },
    "monsters": {
      "file": "monsters.json",
      "count": 317,
      "status": "complete"
    },
    "poisons": {
      "file": "poisons.json",
      "count": 14,
      "status": "complete"
    },
    "rules": {
      "file": "rules.json",
      "count": 172,
      "status": "complete"
    },
    "skills": {
      "file": "skills.json",
      "count": 18,
      "status": "complete"
    },
    "spells": {
      "file": "spells.json",
      "count": 319,
      "status": "complete"
    },
    "tables": {
      "file": "tables.json",
      "count": 38,
      "status": "complete"
    },
    "weapon_properties": {
      "file": "weapon_properties.json",
      "count": 11,
      "status": "complete"
    }
  },
  "terminology": {
    "aliases": {
      "race": "lineage",
      "races": "lineages"
    }
  }
}
